{
  "snapshot_id": "snapshot.example.minimal",
  "snapshot_version": "0.0.1",
  "created_at": "2026-02-16T00:00:00Z",
  "notes": "Non-operational example for schema illustration only. Not a production snapshot.",
  "sources": [
    {
      "source_id": "src-001",
      "source_type": "url",
      "uri": "https://example.com/corpus/identity",
      "retrieved_at": "2026-02-16T00:00:00Z",
      "sha256": "4b4d6bbec06e3e02cb6075b78bb8f9955de127afd8eef5f17ff154bdcb70354f",
      "content_type": "text/html",
      "canonical": true
    },
    {
      "source_id": "src-002",
      "source_type": "url",
      "uri": "https://example.com/corpus/policies",
      "retrieved_at": "2026-02-16T00:00:00Z",
      "sha256": "333381b65b049a14a4b3de075908f9ee4f915c33d2735e40d6083cae969eadc7",
      "content_type": "text/html",
      "canonical": true
    }
  ],
  "integrity": {
    "manifest_sha256": "938a55c7f25fb3900f82f0e6c8a21000302ce8ccacaa0c89b50812758a9dd509",
    "served_bytes_sha256": "0f246dc9f07a16b6b99c72eba623846d8565108fe01232a803d5d5ea9b4469db"
  }
}
